{
  "avatar": {
    "body": {
      "build": "child",
      "height": 0.87,
      "shape": "slim"
    },
    "face": {
      "eyeColor": "eye_hazel",
      "eyes": "monolid",
      "mouth": "small",
      "nose": "broad"
    },
    "hair": {
      "color": "hair_03",
      "style": "hair_fade_mid"
    },
    "kit": "sahne-kit@1",
    "outfit": {
      "bottom": {
        "colors": [
          "fab_39"
        ],
        "id": "bottom_trousers"
      },
      "shoes": {
        "colors": [
          "fab_10"
        ],
        "id": "shoes_velcro"
      },
      "top": {
        "colors": [
          "fab_14"
        ],
        "id": "top_sweater"
      }
    },
    "skin": "skin_06",
    "v": 1
  },
  "bio": "One of the row of kindergarten children who sing on the park stage.",
  "bioFa": "یکی از بچه‌های مهدکودک که در ردیفِ روی صحنه‌ی پارک آواز می‌خوانند.",
  "color": "#8A8580",
  "id": "child_2",
  "kind": "extra",
  "level": "A1",
  "name": "Çocuk",
  "nameFa": "بچه",
  "order": 110,
  "places": [
    "park_ferikoy"
  ],
  "role": "A kindergarten child at the park show",
  "roleFa": "بچه‌ی مهدکودک در جشنِ پارک"
}
