{
  "avatar": {
    "body": {
      "build": "child",
      "height": 0.88,
      "shape": "broad"
    },
    "face": {
      "ears": "small",
      "eyeColor": "eye_grey",
      "mouth": "thin",
      "nose": "broad",
      "shape": "square"
    },
    "hair": {
      "color": "hair_11",
      "style": "hair_afro_puffs"
    },
    "kit": "sahne-kit@1",
    "outfit": {
      "dress": {
        "colors": [
          "fab_05"
        ],
        "id": "dress_kids_play"
      },
      "shoes": {
        "colors": [
          "fab_11",
          "fab_11",
          "fab_15"
        ],
        "id": "shoes_sneakers"
      }
    },
    "skin": "skin_04",
    "v": 1
  },
  "bio": "One of the row of kindergarten children who sing on the park stage.",
  "bioFa": "یکی از بچه‌های مهدکودک که در ردیفِ روی صحنه‌ی پارک آواز می‌خوانند.",
  "color": "#8A8580",
  "id": "child_5",
  "kind": "extra",
  "level": "A1",
  "name": "Çocuk",
  "nameFa": "بچه",
  "order": 113,
  "places": [
    "park_ferikoy"
  ],
  "role": "A kindergarten child at the park show",
  "roleFa": "بچه‌ی مهدکودک در جشنِ پارک"
}
