{
  "avatar": {
    "body": {
      "build": "adult",
      "height": 0.38,
      "shape": "broad"
    },
    "carry": {
      "colors": [
        "fab_12"
      ],
      "id": "bag_backpack"
    },
    "face": {
      "brows": "thick",
      "ears": "large",
      "eyeColor": "eye_amber",
      "eyes": "hooded",
      "shape": "diamond"
    },
    "hair": {
      "color": "hair_15",
      "style": "hair_bun_low"
    },
    "kit": "sahne-kit@1",
    "outfit": {
      "bottom": {
        "colors": [
          "fab_24"
        ],
        "id": "bottom_trousers_wide"
      },
      "shoes": {
        "colors": [
          "fab_50",
          "fab_32",
          "fab_01"
        ],
        "id": "shoes_sneakers"
      },
      "top": {
        "colors": [
          "fab_43"
        ],
        "id": "top_hoodie"
      }
    },
    "skin": "skin_08",
    "v": 1,
    "wear": {
      "head": {
        "colors": [
          "fab_04"
        ],
        "id": "headscarf_sport"
      }
    }
  },
  "bio": "Rides across the city with everyone else; also one of the crowd on the street.",
  "bioFa": "مثلِ بقیه در شهر رفت‌وآمد می‌کند؛ گاهی هم یکی از جمعیتِ خیابان است.",
  "color": "#8A8580",
  "id": "passenger_6",
  "kind": "extra",
  "level": "A1",
  "name": "Yolcu",
  "nameFa": "مسافر",
  "order": 125,
  "places": [
    "metro_m2",
    "metro_m11",
    "bus",
    "vapur_deck",
    "vapur_pier",
    "kadikoy",
    "istiklal_street"
  ],
  "role": "A passenger on the metro, the bus or the ferry",
  "roleFa": "مسافرِ مترو، اتوبوس یا کشتی"
}
